{
  "$schema": "./schemas/deployment-metrics.schema.json",
  "version": "1.0.0",
  "lastUpdated": "2026-01-26T21:30:00.000Z",
  "watchtowerStatus": {
    "operational": true,
    "pollInterval": 300,
    "lastCheck": "2026-01-26T21:25:00.000Z",
    "notificationsEnabled": true,
    "httpApiEnabled": true,
    "metricsEndpoint": "http://staging.ectropy.internal:8080/v1/metrics"
  },
  "environments": {
    "staging": {
      "services": {
        "api-gateway": {
          "image": "registry.digitalocean.com/ectropy-registry/api-gateway:latest",
          "imageDigest": "sha256:f604fbec94a3c4d2e8f3e1234567890abcdef1234567890abcdef1234567890a",
          "tag": "latest",
          "commitSha": "20617cbd8a7e9f7654321098765432109876543210987654321098765432109a",
          "status": "healthy",
          "deployedAt": "2026-01-26T20:09:14.000Z",
          "deployedBy": "watchtower",
          "uptime": "1h 20m",
          "healthScore": 85,
          "restartCount": 0
        },
        "web-dashboard": {
          "image": "registry.digitalocean.com/ectropy-registry/web-dashboard:latest",
          "imageDigest": "sha256:50360adecba0b1c2d3e4f567890abcdef1234567890abcdef1234567890abcd",
          "tag": "latest",
          "commitSha": "20617cbd8a7e9f7654321098765432109876543210987654321098765432109a",
          "status": "healthy",
          "deployedAt": "2026-01-26T20:09:16.000Z",
          "deployedBy": "watchtower",
          "uptime": "1h 20m",
          "healthScore": 95,
          "restartCount": 0
        },
        "mcp-server": {
          "image": "registry.digitalocean.com/ectropy-registry/mcp-server:latest",
          "imageDigest": "sha256:7c224c18df63a2b3c4d5e678901abcdef1234567890abcdef1234567890abcdef",
          "tag": "latest",
          "commitSha": "20617cbd8a7e9f7654321098765432109876543210987654321098765432109a",
          "status": "healthy",
          "deployedAt": "2026-01-26T20:09:13.000Z",
          "deployedBy": "watchtower",
          "uptime": "1h 21m",
          "healthScore": 90,
          "restartCount": 0
        }
      },
      "lastDeployment": {
        "timestamp": "2026-01-26T20:09:16.000Z",
        "commitSha": "20617cbd8a7e9f7654321098765432109876543210987654321098765432109a",
        "status": "success",
        "triggeredBy": "watchtower-poll",
        "servicesUpdated": ["api-gateway", "web-dashboard", "mcp-server"],
        "duration": 420
      },
      "statistics": {
        "totalDeployments": 47,
        "successfulDeployments": 46,
        "failedDeployments": 1,
        "successRate": 97.87,
        "averageDeploymentTime": 420,
        "deploymentsLast24h": 3,
        "deploymentsLast7d": 15,
        "lastSuccess": "2026-01-26T20:09:16.000Z",
        "lastFailure": "2026-01-24T14:32:00.000Z"
      }
    },
    "production": {
      "services": {},
      "lastDeployment": {
        "timestamp": "2026-01-20T15:00:00.000Z",
        "commitSha": "def456abcdef456abcdef456abcdef456abcdef456abcdef456abcdef456abc",
        "status": "success",
        "triggeredBy": "manual",
        "servicesUpdated": [],
        "duration": 180
      },
      "statistics": {
        "totalDeployments": 12,
        "successfulDeployments": 12,
        "failedDeployments": 0,
        "successRate": 100.0,
        "averageDeploymentTime": 180,
        "deploymentsLast24h": 0,
        "deploymentsLast7d": 1,
        "lastSuccess": "2026-01-20T15:00:00.000Z"
      }
    }
  }
}
